{
  "schema": "creation-authoring.v1",
  "project": "player-devotion-reference",
  "game": "SkyrimSE",
  "sourcePlugin": "PlayerDevotion_Framework.esp",
  "output": "PDV_AutoWireReference.esp",
  "metadata": {
    "referenceOnly": true,
    "note": "Player Devotion is a fixture for real VMAD/property failure modes, not a product boundary."
  },
  "operations": [
    {
      "id": "pdv-mcm-core-script",
      "kind": "vmad.attach_script",
      "target": "PDV_MCM",
      "payload": {
        "script": "PDV_MCM",
        "properties": [
          { "name": "PDV_Manager", "type": "Object", "value": "PDV__ManagerQuest" },
          { "name": "PDV_FLST_AllDeities", "type": "Object", "value": "PDV_FLST_AllDeities" },
          { "name": "PDV_GLO_ActivePiety", "type": "Object", "value": "PDV_GLO_ActivePiety" },
          { "name": "PDV_GLO_ActiveTier", "type": "Object", "value": "PDV_GLO_ActiveTier" },
          { "name": "PDV_GLO_ActiveDeityIndex", "type": "Object", "value": "PDV_GLO_ActiveDeityIndex" },
          { "name": "PDV_GLO_PatronDeity", "type": "Object", "value": "PDV_GLO_PatronDeity" },
          { "name": "PDV_GLO_DebugLevel", "type": "Object", "value": "PDV_GLO_DebugLevel" }
        ]
      }
    }
  ]
}
